{
  "version": 1,
  "id": "tj-2026-hebei-yimo-25",
  "domain": { "minX": -4, "maxX": 6, "minY": -1, "maxY": 6 },
  "movingParam": "t",
  "expressionEnv": [
    { "name": "a1", "expr": "1" },
    { "name": "b1", "expr": "2" },
    { "name": "c1", "expr": "3" },
    { "name": "aI", "expr": "1/7" },
    { "name": "bI", "expr": "2/7" },
    { "name": "cI", "expr": "6/7" },
    { "name": "yII", "expr": "3-7*aI" },
    { "name": "xHI", "expr": "-1+5.477225575051661" },
    { "name": "aR", "expr": "0.15725992956937823" },
    { "name": "bR", "expr": "2*aR" },
    { "name": "cR", "expr": "3-15*aR" },
    { "name": "yIR", "expr": "3-7*aR" },
    { "name": "xHR", "expr": "-1+5.358898943540673" }
  ],
  "fixedPoints": {
    "O": ["0", "0"],
    "D1": ["-1", "2"],
    "P": ["3", "3"],
    "M": ["3", "5"],
    "N": ["2", "3"],
    "DII": ["-1", "3-16*aI"],
    "I": ["2", "yII"],
    "H": ["xHI", "5"],
    "DIR": ["-1", "3-16*aR"],
    "IR": ["2", "yIR"],
    "HR": ["xHR", "5"]
  },
  "movingPoints": {},
  "curves": [
    { "id": "parabolaPart1", "type": "parabola", "a": "a1", "b": "b1", "c": "c1" },
    { "id": "parabolaPart2Answer1", "type": "parabola", "a": "aI", "b": "bI", "c": "cI" },
    { "id": "parabolaPart2Root", "type": "parabola", "a": "aR", "b": "bR", "c": "cR" }
  ],
  "derivedIntersections": []
}
